,sentence,tag
177,brute script - Set of scripts for performing brute force attacks to guess access credentials,B-function I-function O O O B-function O O B-attack I-attack I-attack O O B-feature I-feature
178,default script - The most popular Nmap scripts using -sC by default,B-function I-function O O O O B-function I-function O O O B-feature
179,discovery script  - Scripts related to network discovery service discovery and host discovery,B-function I-function  O  B-function O O B-technique I-technique B-technique I-technique O B-technique I-technique
180,dos script - Denial of service attack scripts used to test and perform DOS and floods,B-function I-function O B-attack I-attack I-attack I-attack B-function O O B-function O B-function B-attack O B-attack
181,exploit script - Used to perform service exploitation on different CVEs,B-function I-function O  O O O B-technique I-technique O O B-vulnerability
182,external  script -  Scripts that rely on 3rd party services or data,B-function I-function O  B-function O O O B-app I-app I-app O B-data
183,fuzzer script - Used to perform fuzzing attacks against apps services or networks,B-function I-function O O O B-function B-attack I-attack O B-app B-app O B-system
184,intrusive script -  All the aggressiveâ scripts that cause a lot of network noise,B-function I-function O  O O B-feature B-function O O O O O B-feature I-feature
185,malware  script - Malware detections and exploration scripts,B-function I-function O B-technique I-technique O B-technique B-function
186,safe script - Safe and non-intrusive or noisy scripts,B-function I-function O  B-feature O B-feature O B-feature B-function
187,version script - OS service and software detection scripts,B-function I-function O B-system O B-app O B-technique I-technique B-function
188,vuln script - The Nmap vuln category includes vulnerability detection and exploitation scripts,B-function I-function O O B-tool B-vulnerability O O B-technique I-technique O B-technique B-function
189,The following is the output of scanning the Metasploitable 2 host,O O O O B-feature O B-technique O B-system I-system I-system
190,Nmap also allows you to run scripts using wildcards meaning you can target multiple scripts that finish or end up with any pattern ,B-tool O O O O B-function B-function O B-function O O O O O B-function O O O O O O O O 
191,For example if you want to run all the scripts that begin with FTPâ you could use this syntax,O O O O O O B-function O O B-function O O O B-feature O O O O B-feature
192,This is the perfect solution when you already know which script is going to be used ,O O O O O O O O O O B-function O O O O O 
193,if we want to run the HTTP-brute script to perform brute force password auditing against HTTP basic digest and ntlm authentication ,O O O O O O B-function I-function O O B-function I-function B-feature B-technique O B-feature I-feature B-function O B-technique  I-technique
194,NSE has the ability to let you write your own scripts and run those scripts locally in your operating system ,B-tool O O O O O O O Or O B-function O B-function O B-function B-feature O O B-system I-system 
195,Firewall Intrusion Prevention Systems IPS and Intrusion Detection Systems IDS are only as robust as you configure them for your perimeter security needs,B-feature B-tool I-tool I-tool  I-tool O O B-tool I-tool I-tool I-tool O O O O O O B-function O O O B-technique I-technique O
196,Where they reside on your network how they interact and improving Penetration Pen Testing services is key to having a strong defensive perimeter for your organization,O O O O O B-system O O O O O B-technique I-technique I-technique I-technique O O O O O O B-technique I-technique O O B-system
197,IDS network security and IPS security along with Firewall leveraging can help provide this,B-technique I-technique I-technique O B-technique I-technique O O B-tool O O O O O
198,Cyberinfrastructures using prevention platforms require both regularly scheduled performance assessments and changing topology etc,B-system O B-technique B-system O O O O B-technique I-technique O O B-feature O
199,Most industry-standard institutes recommend even more frequent assessments,O O O O O O O B-technique
200,It is advised to change your current devices around at a certain frequent level,O O O O O O O B-system O O O O O O
201,If they are always static on-going cybercriminals learn how they always sit on your perimeter and eventually hack them after long periods in scanning for weaknesses,O O O O B-feature O B-attacker O O O O O O O O O O B-attack O O O O O B-technique O B-vulnerability
202,When performing pentest against your own networks basically you are evading your own security systems,O O B-technique O O O B-system O O O B-technique O O B-system I-system
203,We usually refer to these self-targeted evading activities as ethical hacking and perform the pentesting as â'white- hats',O O O O O B-technique I-technique I-technique I-technique O B-technique I-technique O O O B-technique O B-securityTeam
204,Pentesting helps understand the danger of real attackers,B-technique O O O O O O B-attacker
205,If you can sneak around a blocked portmapper port using Nmap direct RPC scanning then so can the bad guys,O O O O O O B-feature B-tool B-feature O B-tool O B-technique I-technique O O O O B-attacker I-attacker
206,It is easy to make a mistake in configuring complex firewalls and other devices,O O O O O O O O B-function O B-tool O O B-system
207,Many of them even come with glaring security holes that conscientious users must find and close,O O O O O O O B-vulnerability I-vulnerability O O B-user O O O O
208,Regular network scanning can help find dangerous implicit rules before attackers do,O B-technique I-technique O O O O O B-function O B-attacker O
209,There are good reasons for evading IDS as well Product evaluation is one of the most common,O O O O O B-technique B-tool O O B-technique I-technique O O O O O O
210,If attackers can slide under the radar by simply adding an Nmap flag or two the system does not offer much protection,O B-attacker O O O O O O O O O B-tool B-feature O O O B-system  O O O O B-feature
211,Pentesting tools such as Nmap and Metasploit offer many features for evading firewall rules or sneaking past IDSs,B-tool I-tool O O B-tool O B-tool O O O O B-technique B-function I-function O B-technique I-technique B-tool
212,These capabilities allow bad guysâ to misuse it for evilâ purposes,O O O B-attacker I-attacker O O O O O O
213,However from the administrator perspectives mimicking attackersâ behaviors and actions maybe the best that they can do toidentify security holes before attackers do,O O O B-securityTeam O O B-attacker O O O O O O O Oy O O O O B-vulnerability I-vulnerability O B-attacker O
214,This lab is by-no-mean the utterly and eagerly promoting Nmap and Metasploit,O O O O O O O O O B-tool O B-tool
215,It simply introduces the beginning level of cyber defenders,O O O O O O O  B-securityTeam I-securityTeam
216,to start their network security endeavors in the area of penetration testing,O O O B-technique I-technique O O O O O B-technique I-technique
217,since we know pentesting represents the art of cybersecurity,O O O B-technique O O O O B-technique
218,deep understanding of the given security system,O O O O O B-system I-system
219,The goal of this pentest is to assess the firewall rule setup and IDS system ,O O O O B-technique O O B-technique O B-function I-function B-system O B-tool I-tool 
220,In this pentest we apply the white-box testing strategy in which a white-box tester has the access and knowledge levels of the system admin including the knowledge of iptables firewall rules and snort rules setup,O O B-technique O O O B-technique I-technique I-technique O O O  B-securityTeam I-securityTeam O O O O O O O O  B-securityTeam I-securityTeam O O O O B-feature B-function I-function O B-function I-function B-system
221,The goal of the pentest is to explore the configuration issues of iptables and snort ie identify the system weakness due to configuration flaws ,O O O O B-technique O O O O B-feature O O B-feature O B-tool O O O B-system B-vulnerability O O B-vulnerability I-vulnerability 
222,This means that the pen tester knows the iptables and snort configurations and networking system setup,O O O O  B-securityTeam I-securityTeam O O B-app O B-tool B-feature O B-system I-system I-system
223,During the pen test the pen tester can monitor the actions or output of iptables and snort,O O B-technique I-technique O B-securityTeam I-securityTeam O B-technique O O O B-feature O B-feature O B-tool
224,The pen tester tries to explore vulnerabilities focusing on two areas,O B-securityTeam I-securityTeam O O B-technique B-vulnerability O O O O
225,System configurations - firewall setup such as open close filter unfilter ports reachable services or nodes firewall performance measurements etc,B-feature I-feature O B-tool B-system O O B-feature B-feature B-feature  B-feature B-feature O B-app O B-system B-tool B-technique I-technique O
226,IDS setup such as detection threshold setup success and missed attack scenarios etc,B-tool B-system O O B-feature I-feature I-feature O O O B-attack I-attack O
227,Vulnerabilities There is one Metasploitable-2 VM running behind the firewall,B-vulnerability O O O B-system B-system B-function O O B-tool 
228,The pen tester is required to assess the security performance of the firewall and IDS on successfully stop and/or detect deployed attacks,O B-securityTeam I-securityTeam O O O B-technique O B-technique I-technique O O B-tool O B-tool O O O O B-technique B-function B-attack
229,Location: The pen tester explores the configuration vulnerabilities from outside ie on the client network,O O  B-securityTeam I-securityTeam O O B-vulnerability I-vulnerability O O O O O B-system I-system
230,Assessment: The pen tester needs to develop a pentest report based on the provided template and provide suggested changes or remediation of firewall and IDS rules to maximally improve the system security ,B-technique O O  B-securityTeam I-securityTeOm O O O O B-technique O O O O O B-feature O O O chOnges O O O B-tool O B-tool B-function O O O O B-technique I-technique 
231,Note that the Metasploitable 2 is used for assessing the firewall and IDS ,O O O B-system I-system O O O B-technique O B-tool O B-tool
232,Note that your pentest focus is to inspect and assess the security strength of the firewall and IDS,O O O B-technique O O O B-technique O B-technique O B-technique O O O B-tool O B-tool
233,Please do not try to resolve any vulnerable issues running on Metasploitable 2 which is purposely designed for pentesting,O O O O O B-technique O B-vulnerability I-vulnerability O O B-system I-system O O O O O B-technique
234,Tools: The pen tester can use various tools provided in the given client VM such as Nmap hping3 MSF Metasploit framework tcpdump etc ,O O  B-securityTeam I-securityTeam O O O O O O O O B-system I-system O O B-tool B-tool B-tool I-tool I-tool B-tool O 
235,It should be sufficient to use these tools for this lab,O O O O O O O B-tool O O O
236,However you can use or develop your own tools and testing scripts to perform the security testing,O O O O O O Or O B-tool O B-function B-function O B-function O B-technique I-technique
237,You should perform your pentesting tasks on the client machine,O O O O B-technique O O O B-system I-system
238,You can run various tools such as ping traceroute nmap hpings msfconsole etc on the client node,O O O O B-tool O O B-tool B-tool B-tool B-tool B-tool O O O B-system I-system
239,Gateway Node Ubuntu 1804 You need to run iptables firewall and snort to protect the server node based on provided iptables and snort configuration files,B-system I-system B-system I-system O O O B-function B-app B-tool O B-tool O B-feature O B-system I-system O O O B-app O B-tool B-data I-data
240,You can download the iptables configuration files and snort rule files using the following commands,O O O O O B-app B-data I-data O B-function I-function B-data O O O B-function
241,They are shell scripts ,O O B-function I-function 
242,To make them executable you can change their permission,O O O O O O O O B-feature
243,you need to change the parameter setup at the beginning of the pentest and reset based on your lab running environment ie  three  interfaces  and  IP addresses,O O O O O B-feature I-feature O O O O O B-technique O B-feature O O O O O O O  O B-app O B-feature I-feature
244,make sure you have set up your default GW properly on each VM,O O O O O O O B-feature O  O O O B-system O
245,Server Node Metastploitable 2,B-system I-system B-system I-system
246,details on Metasploitable 2 especially the vulnerable services running on it ,O O B-system I-system O O B-vulnerability B-app O O O 
247,You do not need to make any changes or adjustments on the provided Metasploitable 2 virtual machine in this lab,O O O O O O O O O O O O O B-system I-system B-system I-system O O O
248,In this lab iptables snort Nmap and Metasploit are four major security services and tools that you will use ,O O O B-feature B-tool B-tool O B-tool O O O B-app I-app O B-tool O O O O 
249,Iptables firewall Snort IDS ,B-feature B-tool B-tool I-tool
250,demonstrate how to successfully deploy attacks through the firewall ,O O O O B-function B-attack O O B-tool 
251,you need to successfully exploit at least two vulnerabilities to compromise the targeted service or application,O O O O B-function O O O B-vulnerability O O O B-app I-app O B-app
252,stop the service gain access to the command shell modify data or service parameters steal critical data modify system configuration or setup ,O O B-app O B-feature O O B-tool I-tool O B-data O B-app B-feature B-technique B-feature B-data O B-feature I-feature O B-system 
253,How to identify the vulnerability,O O B-technique O B-vulnerability
254,The steps of using Metasploit to explore the vulnerability,O O O O B-tool O B-technique O B-vulnerability
255,Suggest the countermeasure or mitigation solutions based on given firewall rules ,O O B-technique O B-technique I-technique O O O B-function I-function
256,Detecting and Subverting Firewalls and Intrusion Detection Systems,B-technique O B-technique B-tool O B-tool I-tool I-tool 
257,firewall setup that you want to perform the pentest,B-tool B-system O O O O B-function O B-technique
258,To have better understanding of various scans you can use firewall reset to clear the firewall rules and set it to blacklist ,O O O O O O B-technique O O O B-tool B-function O O O B-function I-function O O O O B-feature
259,change your scanning target directly to the Metasploitable-2 VM,O O B-technique B-system O O O B-system I-system B-system
260,compare scanning responses with the firewall rules,O B-technique B-feature O O B-function I-function
261,you can observe results w/o firewall rules to interpret the scanning outcomes,O O O O O B-function I-function O O O B-technique O
262,Nmap and Metasploit Framework are installed on both the Client and Gateway VMs ,B-tool O B-tool I-tool O O O O O B-system O B-system I-system 
263,Thus you can also compare the scanning results on the Client vs on the Gateway which can help you determine if the firewall successfully defend a scan or attack,O O O O O O B-technique O O O B-system O O O B-system O O O O O O O B-tool O B-technique O B-technique O B-attack
264,Using tcpdump to monitor the traffic from both ingress and egress ports of the gateway is always the best approach to help you understand the actions performed on the Gateway,O B-tool O B-technique O B-data O O B-feature O B-feature B-feature O O B-system O O O O O O O O O O O O O O B-system
265,you are not restricted by the enumerated scanning approaches and provided hints ,O O O O O O O B-technique O O O O 
266,pentest is the art of cyberdefense and you need to be creative,B-technique O O O O B-technique O O O O O O
267,One helpful feature of the TCP protocol is that systems are required by RFC 793 to send a negative response to unexpected connection requests in the form of a TCP RST reset packet ,O O O O O B-feature I-feature O O B-system O O O B-feature I-feature O O O B-feature I-feature O O B-feature I-feature O O O O O B-data I-data I-data I-data 
268,The RST packet makes closed ports easy for Nmap to recognize,O B-data I-data O B-feature B-feature O O B-tool O O
269,Filtering devices such as firewalls on the other hand tend to drop packets destined for disallowed ports,B-feature B-system O O B-tool O O oOr O O O O B-data O O O B-feature
270,In some cases they send ICMP error messages usually port unreachable instead,O O O O O B-data I-data I-data O B-feature I-feature O
271,Because dropped packets and ICMP errors are easily distinguishable from RST packets Nmap can reliably detect filtered TCP ports from open or closed ones and it does so automatically,O B-data I-data O B-data I-data O O O O B-data I-data B-tool O B-feature B-technique B-feature B-feature I-feature O B-feature O B-feature O O O O O O
272,The ACK scan sends TCP packets with only the ACK bit set ,O B-technique I-technique O B-data I-data O O O B-data I-data I-data O 
273,Whether ports are open or closed the target is required by RFC 793 to respond with a RST packet,O B-feature O B-feature O B-feature O B-system O O O B-feature I-feature O B-feature O O B-data I-data
274,Firewalls can block the probe,B-tool O B-feature O B-technique
275,the firewall usually makes no response or send back an ICMP destination unreachable error ,O B-tool O O O B-feature O O O O B-data I-data I-data I-data
276,This distinction allows Nmap to report whether the ACK packets are being filtered,O O O B-tool O O O O B-data I-data O O B-feature
277,The set of filtered ports reported by an Nmap ACK scan is often smaller than for an SYN scan against the same machine because ACK scans are more difficult to filter,O O O B-feature I-feature O O O B-tool B-technique I-technique O O O O O O B-technique I-technique O O O B-system O B-technique I-technique O O O O B-feature
278,Stateless firewall can block incoming SYN packets without the ACK bit set is an easy way to do this but it still allows any ACK packets through ,B-feature B-tool O B-feature B-feature B-data I-data O O B-data I-data I-data O O O O O O O O O O O O B-data I-data O 
279,Blocking those ACK packets is more difficult because they do not tell which side started the connection,B-feature O B-data I-data O O O O O O O O O O O O B-feature
280,Run SYN scan and ACK scan and compare difference,O B-technique I-technique O B-technique I-technique O O O
281,To block unsolicited ACK packets as sent by the Nmap ACK scan while allowing ACK packets belonging to legitimate connections ,O B-feature B-attack B-data I-data O O O O B-tool B-technique I-technique O O B-data I-data O O B-feature B-feature
282,firewalls must statefully watch every established connection to determine whether a given ACK is appropriate,B-tool O B-feature O O B-feature I-feature O O O O O B-feature O O
283,Please check the provided iptables firewall rules and check where the stateful firewall policies kicked in ,O O O O B-feature B-tool B-function O O O O B-feature B-tool O O O 
284,These stateful firewalls are usually more secure because they can be more restrictive,O B-feature B-tool O O O B-feature O O O O O O
285,Blocking ACK scans is one extra available restriction ,B-feature B-technique I-technique O O O O O 
286,The downsides are that they require more resources to function and a stateful firewall reboot can cause a device to lose state and terminate all established connections passing through it,O O O O O O O O O O O O B-feature B-tool B-function O O O B-system O O B-feature O O O B-feature I-feature O O O
287,the key analysis point of this task is to check the feedback of Nmap scans with different scanning options to understand the implication of Nmap outputs: filtered unfiltered closed open ,O O O O O O O O O O O O O B-tool B-technique O O B-technique O O O O O O B-tool B-feature: B-feature B-feature B-feature B-feature 
288,What are the implications of the firewall setup according to these feedback,O O O O O O B-tool B-system O O O O
289,Systems running TCP protocol is required by RFC 793 to send a negative response to unexpected connection requests in the form of a TCP RST reset packet,B-system O B-feature I-feature O O O B-feature I-feature O O O B-feature I-feature O O B-feature I-feature O O O O O B-data I-data I-data I-data
290,the key analysis point of this task is how to infer the deny-by-default firewall policy based on the scanning responses from the firewall,O O O O O O O O O O O O B-feature B-tool B-feature O O O B-technique B-feature O O B-tool
291,The ACK scan sends TCP packets with only the ACK bit set Whether ports are open or closed the target is required by RFC 793 to respond with a RST packet,O B-feature I-feature O B-data I-data O O O B-data I-data I-data O B-feature O B-feature O B-feature O B-system O O O B-feature I-feature O O O O B-data I-data
292,the key analysis point of this task is how to infer stateful or stateless firewall policies setup based on the scanning responses from the firewall,O O O O O O O O O O O B-feature O B-feature B-tool B-feature B-system O O O B-technique B-feature O O B-tool
293,What is your observation of the responding time of each type of scans and what is the reason and implications?,O O O O O O O O O O O O B-technique O O O O O O O
294,Find at least one accessible open or closed port of one machine on the internal network ,O O O O O B-feature O B-feature B-feature O O B-system O O O B-system 
295,The machine chosen should have little network traffic to avoid confusing results ,O B-system O O O O B-data I-data O O O O 
296,Most Linux system does not work,O B-system I-system O O O
297,Verify that the machine has predictable IP ID sequences ,O O O B-system O O B-feature I-feature O 
298,targeting a Windows XP the Nping options request that five SYN packets be sent to port 80 one second apart,O O B-system I-system O B-tool O O O O B-data I-data O O O B-feature I-feature O O O
299,Start a flooding to a chosen host ,O O B-attack O O O B-system
300,Do not use any of the address from the nping node,O O O O O O B-feature O O B-tool B-system
301,It shows that the IP IDs are increasing by roughly 11 per second instead of one ,O O O O B-feature I-feature O O O O O O O O O O 
302,The target 19216803 is receiving our 10 forged packets per second and responding to each of them,O B-system O O O O O B-attack I-attack O O O O O O O O
303,Repeat step 3 using spoofed addresses that you suspect may be allowed through the firewall ,O O O O B-vulnerability B-feature O O O O O O O O B-tool 
304,This techniqueâs result is a list of source address netblocks that are permitted through the firewall and those that are blocked,O O O O O O O B-system B-feature B-technique O O O O O B-tool O O O O B-feature
305,UDP is often more difficult because the protocol does not provide acknowledgment of open ports like TCP does ,B-feature O O O O O O B-feature O O O O O B-feature I-feature O B-feature O 
306,Many UDP applications will ignore unexpected packets leaving the scanner unsure whether the port is open or filtered ,O B-feature B-app O O O B-data O O B-tool O O O B-feature O B-feature O B-feature 
307,what is the implication of open or filtered states of the UDP scan,O O O O O B-feature  O B-feature O O O B-technique I-technique
308,how to use Nmap to perform port scanning,O O O B-tool O O B-technique I-technique
309,Based on the scanning results can you further deploy idle scan and FTP Bounce scan,O O O B-technique O O O O B-function B-technique I-technique O B-technique I-technique I-technique
310,Nmap uses the -g and source -port options to manipulate source ports of transmitted packets,B-tool O O O O B-system  B-feature O O O B-system B-feature O B-data I-data
311,Many intrusion detection systems have morphed into what marketing departments label intrusion prevention systems,O B-tool I-tool I-tool O O O O O O O B-tool I-tool I-tool
312,Some can only sniff the network like a normal IDS and send triggered packet responses,O O O B-technique O B-system O O O B-tool O O B-feature I-feature I-feature
313,The best IPS systems are inline on the network to restrict packet flow when suspicious activity is detected,O O B-tool I-tool O O O O B-system O O B-feature I-feature O B-vulnerability I-vulnerability O B-technique
314,For example an IPS may block any further traffic from an IP address that they believe has port scanned them or attempted a buffer overflow exploit,O O O B-tool O B-feature O O B-data O O B-feature I-feature O O O O B-technique I-technique O O O B-attack I-attack I-attack
315,Attackers are likely to notice this if they port scan a system and cannot connect to the reported open ports,B-attacker O O O O O O O B-technique I-technique O B-system O O O O O O B-feature I-feature
316,Attackers can confirm that they are blocked by trying to connect from another IP address,B-attacker O O O O O B-feature O O O O O O B-feature I-feature
317,Suspicious response packets can also tip-off that an IDS has flagged an attackerâs actions,B-vulnerability B-data I-data O O O O O B-tool O B-feature O B-attacker O
318,In particular many IDSs that are not inline on the network will forge RST packets to tear down connections ,O O O B-tool O O O O O O B-system O B-vulnerability B-data I-data O O O B-feature 
319,Ways to determine that these packets are forged are covered in the section called Detecting Packet Forgery by Firewall and Intrusion Detection Systems ,O O O O O B-data O B-vulnerability O O O O O O B-technique B-attack I-attack O B-tool O B-tool I-tool I-tool 
