,sentence,tag
320,For example the Linux iptables system which offers many methods for rejecting undesired packets by using:,O O O B-system B-app B-system O O O O O O O B-data O O
321,The type given can be icmp-net-unreachable icmp-host-unreachable icmp-port-unreachable icmp-proto-unreachable icmp-net-prohibited or icmp-host-prohibited which return the appropriate ICMP error message port-unreachable is the default ,O O O O O B-feature B-feature B-featureB-feature B-feature O B-feature O O O O B-data I-data I-data B-feature O O O 
322,The option tcp-reset can be used on rules which only match the TCP protocol,O O B-feature O O O O B-function O O O O B-feature I-feature
323,this causes a TCP RST packet to be sent back,O O O B-data I-data I-data O O O O
324,This is mainly useful for blocking ident 113/tcp probes which frequently occur when sending mail to broken mail hosts which wonât accept your mail otherwise,O O O O O B-featureB-feature I-feature B-technique O O O O O O O B-feature B-system I-system O O O O O O
325,Forging RST packets by firewalls and IDS or IPS is not particularly common outside of port 113,B-attack B-data I-data O B-tool O B-tool O B-tool O O O O O O B-feature I-feature
326,It can be confusing to legitimate network operators and allows scanners to immediately move on to the next port without waiting on the timeout caused by dropped packets ,O O O O O B-feature B-securityTeam I-securityTeam O O B-tool O O O O O O O B-feature O O O O B-feature O O B-data I-data 
327,"Such forgery canusually be detected by careful analysis of the RST packet compared to other packets sent by the machine ","O B-attack O
O O B-technique O O B-technique O O B-data I-data O O O B-data O O O B-system "
328,you can purposely alter some iptables rules and observe the difference and how the changes can impact your inferences about the firewall setup,O O O O O B-app B-function O O O O O O O O O O O O O O B-tool B-system
329,One way to detect certain IDSs is to watch for unexplained gaps or suspicious machines in traceroutes ,O O O B-technique O B-tool O O O O O O O B-vulnerability B-system O B-tool 
330,While most operating systems include a traceroute command Nmap offers a faster and more effective alternative with the traceroute option,O O B-system I-system O O B-tool B-function B-tool O O O O O O O O O B-tool O
331,This approach may only detect inline IDSs instead of those that passively sniff the network without being part of the route ,O O O O B-technique B-feature B-tool O O O O B-feature B-technique O B-system O O O O O B-function 
332,Additionally inspect iptables rules and output from Nmap and ping and explain why the above-issued commands cannot return the path information,O B-technique B-app B-function O O O B-tool O B-function O O O O O B-function O O O O B-data
333,The following techniques are used to avoid being detected by the IDS snort ,O O O O O O O O B-technique O O B-tool B-tool 
334,Your snort can detect many scanning activities based on the given snort rules,O B-tool O B-technique O B-technique O O O O O B-function I-function
335,how to configure your scanning parameters in the following given strategies,O O B-function O B-technique B-feature O O O O O
336,from slow down to DNS proxying which ones you can deploy in our testing environment,O B-feature I-feature O B-system I-system O O O O B-function O O B-system I-system
337,You need to check the rules specified in the given snort local rules,O O O O O B-function O O O O B-tool O B-function
338,Based on the following given Nmap scanning methods design new Nmap scanning commands to avoided being detected by snort rules,O O O O O B-tool B-technique O O O B-tool B-technique B-function O O O B-technique O B-function I-function
339,Nmap offers several timing modes that can be selected with the -T option to accomplish this ,B-tool O O B-feature I-feature O O O O O O O O O O O 
340,For example the -T paranoid option causes Nmap to send just one probe at a time waiting five minutes between them ,O O O O B-feature I-feature O B-tool O O O O B-technique O O O O O O O O 
341,A large scan may take weeks but at least it probably will not be detected ,O O B-technique O O O O O O O O O O O B-technique 
342,The -T sneaky option is similar but it only waits 15 seconds between probes ,O O B-feature I-feature O O O O O O O O O B-technique 
343,Scatter probes across networks rather than scanning hosts consecutively,O B-technique O B-system O O B-technique B-system O
344,IP fragments can be a major problem for intrusion detection systems,B-feature I-feature O O O O O O B-tool I-tool I-tool
345,particularly because the handling of oddities such as overlapping fragments and fragmentation assembly timeouts are ambiguous and differ substantially between platforms ,O O O O O O O O B-feature I-feature O B-feature I-feature I-feature O O O O O O B-system 
346,Thus the IDS often has to guess at how the remote system will interpret a packet,O O B-tool O O O O O O O B-system I-system O O O B-data
347,An Nmap scan will use tiny IP fragments ,O B-tool B-technique O O B-feature I-feature I-feature
348,By default Nmap will include up to eight bytes of data in each fragment so a typical 20 or 24 byte depending on options TCP packet is sent in three tiny fragments,O O B-tool O O O O O B-data O B-data O O B-feature O O typicOl O O O B-data O O O B-data I-data O O O O B-feature I-feature
349,Every instance of -f adds eight to the maximum fragment data size ,O O O O O O O O O B-feature B-feature I-feature 
350,Fragmentation is only supported for Nmapâs raw packet features including TCP and UDP port scans except connect scan and FTP bounce scan and OS detection,B-technique O O O O B-tool B-data I-data O O B-feature O B-feature B-technique I-technique O B-technique I-technique O B-technique I-technique I-technique O B-technique I-technique
351,Features such as version detection and the Nmap Scripting Engine generally donât support fragmentation ,B-feature O O B-technique I-technique O O B-tool I-tool I-tool O O O B-technique 
352,because they rely on your hostâs TCP stack to communicate with target services,O O O O O B-system B-feature I-feature O O O B-app I-app
353,Decoys are added with the -D option,B-technique O O O O O O
354,The argument is a list of hosts separated by commas ,O O O O O O B-system O O O O
355,The string ME can be used as one of the decoys to represent where the true source host should appear in the scan order ,O O O O O O O O O O B-technique O O O O O B-system I-system O O O O B-technique O 
356,source IP and Nmap will launch the requested port scan from that given source,B-system B-feature O B-tool O O O O B-technique I-technique O O O B-system  
357,No useful Nmap results will be available since the target will respond to the spoofed IP and Nmap will not see those responses,O O B-tool O O O O O O B-system O O O O B-vulnerability B-feature O B-tool O O O O B-feature
358,IDS alarms at the target will blame the spoofed source for the scan,B-tool B-function O O B-system O O O B-vulnerability O O O B-technique
359,This can be useful for framing innocent parties casting doubt in the administratorâs mind about his IDS accuracy,O O O O O O O O O O O O B-securityTeam O O O B-tool B-feature
360,The idle scan is a clever technique that allows for spoofing the source IP address as discussed in the previous section while still obtaining accurate TCP port scan results ,O B-O I-O O O O O O O O B-vulnerability O B-system B-feature I-feature O O O O O O O O O O B-technique I-technique I-technique O 
361,This is done by abusing the properties of the IP identification field as implemented by many systems ,O O O O O O O O O B-feature I-feature I-feature O O O O  B-system 
362,However most Linux systems are immune to idle scan attacks,O O B-system I-system O O O B-attack I-attack I-attack
363,Nmap performs reverse-DNS resolution by default against every responsive host ,B-tool O B-function I-function O O O O B-feature B-system 
364,These DNS lookup probes could be detected Even something as unintrusive as a list scan -sL could be detected this way ,O B-function I-function B-technique O O B-technique O O O B-feature O O B-technique I-technique O O O B-technique O O
365,The probes will come from the DNS server configured for the machine running Nmap,O B-technique O O O O B-system I-system B-function O O B-system O B-tool
366,The most effective way to eliminate this risk is to specify -n to disable all reverse DNS resolution ,O O O O O O O B-feature O O O O O O O B-function I-function I-function
367,You can specify one or more of those name servers to the dns-servers option of Nmap and all DNS queries will be proxied through them,O O O O O O O O B-system I-system O O B-system I-system O O B-tool O O B-function I-function O O B-system  O O
368,The scanning results derived from task 1 to task 3 allows you to identify potential vulnerabilities to explore ,O B-technique O O O O O O O O O O O O O O O O B-technique 
369,you need to use Metasploit Framework msf to deploy at least two successful attacks ,O O O O B-tool I-tool I-tool O B-function O O O O B-attack 
370,such as stop the service gain access to the command shell modify data or service parameters steal critical data modify system configuration/setup ,O O O O B-app O B-feature O O B-tool I-tool O B-data O B-app B-feature B-technique B-feature B-data O B-feature I-feature O B-system 
371,you will run the Metasploit Framework MSF command-line CLI for penetration testing,O O O O B-tool I-tool I-tool B-tool I-tool O B-technique I-technique
372,You will learn how to use Metasploit to discover and identify system vulnerabilities ie running Metasploitable 2,O O O O O O B-tool O B-technique O B-technique B-vulnerability I-vulnerability O O B-system I-system
373,Use Metasploit Framework to send vulnerability exploitation packets for vulnerability discovery,O B-tool I-tool O O B-vulnerability B-data I-data O B-technique I-technique
374,Use Metasploit Framework to compromise a vulnerable system ie Metasploitable2,O B-tool I-tool O O O B-vulnerability B-system O B-system
375,The Metasploit Project is a computer security project that provides information about security vulnerabilities and aids in penetration testing and IDS signature development ,O B-tool O O O B-technique I-technique O O O B-data O B-vulnerability I-vulnerability O O O B-technique I-technique O B-technique I-technique I-technique 
376,Boston Massachusetts-based security company Rapid7 owns it ,O O B-technique O B-app O O 
377,Its best-known sub-project is the open-source Metasploit Framework a tool for developing and executing exploit code against a remote target machine,O O O O O B-feature B-tool I-tool O B-tool O O O O B-function I-function O O B-system I-system I-system
378,The Metasploit Project includes anti-forensic and evasion tools some of which are built into the Metasploit Framework ,O B-tool O O B-technique O B-technique B-tool O O O O O O O B-tool I-tool 
379,Metasploit is pre-installed in the Kali Linux operating system ,B-tool O O O O B-system I-system I-system I-system
380,In this lab we use the command-line only version msfconsole which runs on Ubuntu Linux,O O O O O O B-tool O B-feature B-tool O O O B-system I-system
381,The Metasploit framework consists of the core and base many exploits payloads modules Ruby classes pluginâs scripts and multiple user interfaces ,O B-tool I-tool O O O O O O O B-function B-data B-function B-tool B-function B-tool B-function O O B-app I-app 
382,The Metasploit framework also contains some great information- gathering tools called auxiliary modules,O B-tool I-tool O O O O B-data O B-tool O B-tool I-tool
383,Auxiliary modules can be used for port scanning service identification password sniffing and Windows patch enumeration ,B-tool I-tool O O O O B-technique I-technique B-technique I-technique B-technique I-technique O B-technique I-technique I-technique 
384,Metasploit is highly customizable for advanced users and can be customized the meet your custom needs by writing your own exploits modules plugins and scripts ,B-tool O O O O B-user I-user O O O O O O O O O O O O O B-function B-tool B-tool O B-function 
385,If Metasploit does not provide the information gathering module you need by default you can simply write it yourself,O B-tool O O O O B-data O B-tool O O O B-function O O O O O O
386,The msfconsole is the user interface known to be the most stable interface and you can use it to execute external commands like the ping command and the tab auto-completion ,O B-tool O O B-app I-app O O O O O O B-app O O O O O O O B-function I-function O O B-function I-function O O B-function I-function 
387,A graphical user interface is available for Metasploit called Armitage which is not covered in this lab,O B-app I-app I-app O O O B-tool O B-app O O O O O thO O
388,If you are on Kali Linux rolling edition you can start the Metasploit framework and msfconsole by clicking the Metasploit icon in the dock ,O O O O B-system I-system B-feature I-feature O O O O B-tool I-tool O B-tool O O O B-tool O O O B-app 
389,This will start the PostgreSQL service and Metasploit service automatically,O O O O B-app I-app O B-app I-app O
390,You can run the following command to check if Metasploit is installed in your system,O O O O O B-function O O O B-tool O B-function O O B-system
391,If Metasploit is not installed you can follow the procedure below to install Metasploit,O B-tool O O B-function O O O O O O O B-function B-tool
392,The use command in Metasploit is used to activate a particular module and changes the context of the msfconsole to that particular module,O B-function I-function O B-tool O O O O O O B-function O O O O O O B-tool O O O B-function
393,The exploit name will be mentioned in red on the command line,O B-function O O O O O O O O B-tool I-tool
394,In this example you have changed the command lineâs context to the exploit called realvnc_client ,O O O O O O O B-tool I-tool O O O B-function O B-vulnerability
395,Then you retrieve information about this exploit set the required exploit parameters and run it against a target,O O O B-data O O B-technique O O O B-function I-function O O O O O B-system
396,If you want to leave the exploit context and switch back to the msfconsole you can use the back command ,O O O O O O B-function O O O O O O B-tool O O O O B-function I-function 
397,The back command will take us back to the msfconsole in the general context,O B-function I-function O O O O O O B-tool O O O O
398,You can issue the use command again to switch to another Metasploit module,O O O O B-function I-function O O O O anoOr B-tool B-function
399,The exit command will close the msfconsole and will take you back to the Linux terminal,O B-function I-function O O O B-tool O O O O O O O B-system I-system
400,The help command will return a list of possible commands and a description when typed at the msfconsole ,O B-function I-function O O O O O O B-function O O O O O O O B-tool 
401,When an active exploit is selected you can use the help command to get a list of exploit commands ,O O O B-function O O O O O O B-function I-function O O O O O B-function I-function 
402,When an exploit is selected with the use command you can retrieve information like the name platform author available targets and a lot more by using the info command ,O O B-function O O O O B-function I-function O O O B-data O O B-feature B-app B-user O B-system O O O O O O O B-function I-function 
403,you can use the info command on an exploit named ie_execcommand_ua,O O O O B-data B-function O O B-technique O B-vulnerability
404,Metasploit contains over 1500 different exploits and new ones are added regularly ,B-tool O O O O B-technique O O O O O O 
405,With this number of exploits the search function and knowing how to use it becomes very important ,O O O O B-function O B-function I-function O O O O O O O O O 
406,The easiest way of using the search function is by issuing the command search followed by a search term for example flash to search for exploits related to Flash player ,O O O O O O B-function I-function O O O O B-function B-function O O O O O O O O O O O B-technique O O B-tool I-tool 
407,by using the search command Metasploit will search for the given search term in the module names and description,O O O B-function I-function B-tool O O O O O O O O O B-function B-feature O B-feature
408,As expected there are a lot of exploits related to the often vulnerable Flash player software ,O O O O O O O B-technique O O O O B-vulnerability B-app I-app I-app 
409,For example the list includes CVE-2015- 5122 Adobe Flash opaqueBackground Use After Free zero-day which was discovered in the Hacking Team data breach,O O O O O B-vulnerability I-vulnerability I-vulnerability I-vulnerability I-vulnerability I-vulnerability I-vulnerability I-vulnerability O O O O O  B-attacker I-attacker B-attack I-attack
410,You can use the search command with a keyword to search for a specific author an OSVDB ID or a platform ,O O O O B-function I-function O O O O O O O O B-user O B-feature I-feature O O B-app 
411,Now you will be looking at how to show the exploit parameters and change them with the set command ,O O O O O O O O O O B-feature I-feature O O O O O B-function I-function 
412,You will also be looking at how to show the payloads targets advanced and evasion options,O O O O O O O O O O B-data B-system B-feature O B-technique O
413,The show options command will show you the available parameters for an exploit if used when the command line is in exploit context ,O B-function I-function I-function O O O O O B-feature O O B-function O O O O B-tool I-tool O O B-function O 
414,The Flash exploit contains a total of 6 options from which only 2 are required,O B-vulnerability I-vulnerability O O O O O O O O O O O O
415,Note that the show options command is returning the currently selected target below the module options,O O O B-function I-function I-function  O O O O O B-system O O B-function O
416,The default target is 0 which is Windows for the selected exploit,O O B-system O O O O B-system O O O B-function
417,Use the set command followed by the option name and the new value to change the default values,O O B-function I-function O O O O B-feature O O O O O O O O O
418,By using the show options command again you can verify that the SRVHOST and SRVPORT values have been changed ,O O O B-function I-function I-function O O O O O O B-feature O B-feature O O O O 
419,You can change Boolean values by using the set command with option name and true or false,O O O B-function O O O O B-function I-function O O O O O O O
420,When you use the show payloads command the msfconsole will return a list of compatible payloads for this exploit,O O O O B-function I-function I-function O B-tool O O O O O O B-data O O B-function
421,In the flash player exploit example it will return quite a few compatible payloads ,O O B-vulnerability I-vulnerability O O O O O O O O B-data
422,To use a certain payload you need to use the set command followed by the payload name,O O O O B-data O O O O O B-function I-function O O O B-data O
423,The show targets command will return a list of operating systems which are vulnerable to the selected exploit ,O B-function I-function I-function O O O O O B-system I-system O O B-vulnerability O O O B-function 
424,When you run the command you get the following output for the adobe_flash_shader_drawing_fill exploit,O O O O B-function O O O O O O O B-vulnerability I-vulnerability
425,This exploit targets both Windows and Linux operating systems ,O B-function B-system O B-system O B-system B-system I-system 
426,Note that you can use the info command to get additional info about this exploit and targets ,O O O O O O B-data I-function O O O B-data O O B-function O B-system 
427,To set a target you can use the command set followed by the target ID,O O O B-system O O O O B-function I-function O O O B-feature I-feature
428,By setting the target the list of payloads will be reduced a lot because only payloads will be shown which are compatible with the target Linux,O O O B-system O O O B-data O O O O O O O B-data O O O O O O O O B-system B-system
429,By using the show advanced command we can look at the advanced options for the exploit ,O O O B-function I-function I-function O O O O O B-feature I-feature O O B-function 
430,Use the set command followed by the advanced parameter and the new value to change the advanced settings,O O B-function I-function O O O B-feature B-feature O O O O O O O B-feature O
431,The show nops command will return a list of NOP generators,O B-function I-function I-function O O O O O B-function I-function
432,A NOP is short for No Operation and is used to change the pattern of a NOP sled in order to bypass simple IDS/IPS signatures of common NOP sleds,O B-function O O O B-function I-function O O O O O O O O O B-function I-function O O O bypOss O B-tool O B-tool B-feature O O B-function I-function
433,The NOP generators start with the CPU architecture in the name ,O B-function I-function O O O B-system I-system O O O 
434,To use a NOP generator use the set command followed by the name of the NOP generator,O O O B-function I-function O O B-function I-function O O O O O O B-function I-function
435,When the exploit is launched the NOP sleds will be taken from the NOP generator,O O B-function O O O B-function I-function O O O O O B-function I-function
436,The show evasion command returns a list of available evasion techniques ,O B-function I-function I-function O O O O O B-technique I-technique 
437,To change evasions settings use the set command followed by the evasion parameter and the new value,O O B-technique B-feature O O B-function I-function O O O B-technique B-feature O O O O
438,When all the required options have been set for the exploit including a payload and advanced settings like a NOP generator evasion options and encoding the exploit is ready to be executed ,O O O O O O O O O O B-function O O B-data O B-feature B-feature O O B-function I-function B-technique O O B-function O B-function O O O O O 
439,The exploit can be executed using two commands run and exploit ,O B-function O O O O O B-function B-function O B-function 
440,Just type run or exploit in the msfconsole and the exploit will run,O O B-function O B-function O O B-tool O O B-function O O
441,Metasploitable 2 is an intentionally vulnerable Linux machine downloaded and set up as a virtual machine in any hypervisor such as KVM VMware Player and Virtual box,B-system I-system O O O B-vulnerability B-system I-system O O O O O O B-system I-system O O B-system O O B-system B-system I-system O B-system I-system
442,An important part of the Metasploitable 2 enumeration process is the port scanning and fingerprinting process ,O O O O O B-system I-system O O O O B-technique I-technique O B-technique I-technique 
443,Port scanning is used to probe a server or host for open TPC and UDP ports ,B-technique I-technique O O O B-technique O B-system  O B-system O B-feature B-feature O B-feature I-feature 
444,Fingerprinting is the process of identifying the services connected to those ports,B-technique O O O O O O B-app O O O B-feature
445,The default username/password of Metasploitable 2 is msfadmin/msfadmin,O O B-feature O B-system I-system O B-feature
446,When you log in to the vulnerable host you can use the ifconfig command to determine its IP address ,O O O O O O B-vulnerability B-system O O O O B-function I-function O O O B-feature I-feature 
447,You can also use netdiscover on the Kali Linux machine to scan a range of IP addresses for the target host ,O O O O B-tool O O B-system I-system I-system  O B-technique O O O B-feature I-feature O O B-system I-system 
448,You can use the following command to start the Nmap port scan with service and OS detection,O O O O O B-function O O O B-tool B-technique I-technique O B-app O B-technique I-technique
449,The Nmap port scan and service scans return a lot of open ports listening services and the version of the operating system,O B-tool B-technique I-technique O B-technique I-technique O O O O B-feature I-feature O B-app O O B-feature O O B-system I-system
450,The Metasploitable-2 host is running Linux 269 - 2633 as the operating system ,O B-system I-system O O B-system I-system I-system I-system O O B-system I-system 
451,We can see that the host is running an SSH service using OpenSSH a telnet service an Apache 228 webserver 2 SQL servers and some more services ,O O O O O B-system O O O B-app I-app O B-tool O B-app I-app O B-system I-system I-system O B-system I-system O O O B-app 
452,A list of running services and their running ports are given ,O O O O B-app O O O B-feature O O 
453,Metasploitable 2 is intentionally vulnerable ,B-system I-system O O B-vulnerability 
454,Therefore one can only suspect that most if not all of the services contain vulnerabilities backdoors etc,O O O O O O O O O O O O B-app O B-vulnerability B-attack O
455,With user enumeration the penetrations tester sees what users have access to the server and which users exist on the network ,O B-vulnerability I-vulnerability O  B-securityTeam I-securityTeam O O B-user O O O O B-system O O B-user O O O B-system 
456,Another purpose for user enumeration is to gain access to the machine by using brute force techniques ,O O O B-vulnerability I-vulnerability O O O O O O B-system O O B-technique I-technique I-technique 
457,Since the username is already known to the penetration tester the only thing left to brute force is the password ,O O B-feature O O O O O B-securityTeam I-securityTeam O O O O O B-technique I-technique O O B-feature 
